field1_Text_Text,field1_Link_Link
North Beach Gem - 1b1ba IN 2Bd/2Ba - Malthouse SF,https://sfbay.craigslist.org/sfc/apa/d/san-francisco-north-beach-gem-1b1ba-in/7063639711.html
Lucy's Brand new remodeled 2BR flat In The Heart Of North Beach !,https://sfbay.craigslist.org/sfc/apa/d/san-francisco-lucys-brand-new-remodeled/7063271709.html
Studio with pool courtyard view!,https://sfbay.craigslist.org/sfc/apa/d/san-francisco-studio-with-pool/7063034277.html
Fully Furnished Bed and Bath Available in Hayes Valley 2br/2ba Apt,https://sfbay.craigslist.org/sfc/apa/d/san-francisco-fully-furnished-bed-and/7059363053.html
"1br Available - Lower Nob Hil (Private Patio, Home Gym, Furnished)",https://sfbay.craigslist.org/sfc/apa/d/san-francisco-1br-available-lower-nob/7061321054.html
Paramount Studios. is an excellent condo alternative with numerous,https://sfbay.craigslist.org/sfc/apa/d/san-francisco-paramount-studios-is-an/7063797122.html
